{
  "country": "US",
  "denomination": "$10",
  "face_value": 1.0,
  "series": [
    {
      "aliases": [
        "AGET"
      ],
      "coins": [
        {
          "business_strikes": null,
          "category": "coin",
          "coin_id": "US-AGEQ-XXXX-X",
          "composition": {
            "copper": 5.33,
            "gold": 91.67,
            "silver": 3.0
          },
          "designer": "Augustus Saint-Gaudens (obverse), Miley Busiek (reverse)",
          "diameter_mm": 22.0,
          "distinguishing_features": "Augustus Saint-Gaudens (obverse), Miley Busiek (reverse)",
          "mint": "X",
          "notes": "Random year bullion - 1/4 troy oz gold content, dealer's choice year, valued by metal content",
          "obverse_description": "Lady Liberty striding forward with torch and olive branch, Capitol building in background, rays of sunlight",
          "proof_strikes": null,
          "rarity": "common",
          "reverse_description": "Male eagle carrying olive branch flying above nest with female eagle and eaglets",
          "source_citation": "US Mint specifications, bullion dealers",
          "subcategory": "sovereign_bullion",
          "total_mintage": null,
          "varieties": [],
          "weight_grams": 8.483,
          "year": "XXXX"
        }
      ],
      "composition_periods": [
        {
          "alloy": {},
          "alloy_name": "Unknown",
          "date_range": {
            "end": "XXXX",
            "start": "XXXX"
          },
          "weight": {
            "grams": 8.483
          }
        }
      ],
      "official_name": "American Gold Eagle (1/4 oz)",
      "series_code": "AGEQ",
      "series_id": "American Gold Eagle (1/4 oz)",
      "series_name": "American Gold Eagle (1/4 oz)",
      "specifications": {
        "diameter_mm": 22.0,
        "edge": "plain"
      },
      "years": {
        "end": "XXXX",
        "start": "XXXX"
      }
    }
  ]
}