{
  "country": "US",
  "denomination": "Gold Dollars",
  "face_value": 1.0,
  "series": [
    {
      "coins": [
        {
          "business_strikes": 17500,
          "category": "coin",
          "coin_id": "US-LPJF-1903-P",
          "composition": {},
          "diameter_mm": 15.0,
          "mint": "P",
          "proof_strikes": null,
          "rarity": "key",
          "source_citation": "Issue #53 - Classic Commemoratives (1892-1954)",
          "subcategory": "bullion",
          "varieties": [],
          "weight_grams": 1.672,
          "year": 1903
        }
      ],
      "composition_periods": [
        {
          "alloy": {},
          "alloy_name": "Historical",
          "date_range": {
            "end": 1903,
            "start": 1903
          }
        }
      ],
      "official_name": "Louisiana Purchase - Jefferson",
      "series_id": "Louisiana Purchase - Jefferson",
      "series_name": "Louisiana Purchase - Jefferson",
      "specifications": {
        "diameter_mm": 15.0,
        "edge": "plain"
      },
      "years": {
        "end": 1903,
        "start": 1903
      }
    },
    {
      "coins": [
        {
          "business_strikes": 17500,
          "category": "coin",
          "coin_id": "US-LPMK-1903-P",
          "composition": {},
          "diameter_mm": 15.0,
          "mint": "P",
          "proof_strikes": null,
          "rarity": "key",
          "source_citation": "Issue #53 - Classic Commemoratives (1892-1954)",
          "subcategory": "bullion",
          "varieties": [],
          "weight_grams": 1.672,
          "year": 1903
        }
      ],
      "composition_periods": [
        {
          "alloy": {},
          "alloy_name": "Historical",
          "date_range": {
            "end": 1903,
            "start": 1903
          }
        }
      ],
      "official_name": "Louisiana Purchase - McKinley",
      "series_id": "Louisiana Purchase - McKinley",
      "series_name": "Louisiana Purchase - McKinley",
      "specifications": {
        "diameter_mm": 15.0,
        "edge": "plain"
      },
      "years": {
        "end": 1903,
        "start": 1903
      }
    },
    {
      "coins": [
        {
          "business_strikes": 10025,
          "category": "coin",
          "coin_id": "US-LEWC-1904-P",
          "composition": {},
          "diameter_mm": 15.0,
          "mint": "P",
          "proof_strikes": null,
          "rarity": "key",
          "source_citation": "Issue #53 - Classic Commemoratives (1892-1954)",
          "subcategory": "bullion",
          "varieties": [],
          "weight_grams": 1.672,
          "year": 1904
        },
        {
          "business_strikes": 10041,
          "category": "coin",
          "coin_id": "US-LEWC-1905-P",
          "composition": {},
          "diameter_mm": 15.0,
          "mint": "P",
          "proof_strikes": null,
          "rarity": "key",
          "source_citation": "Issue #53 - Classic Commemoratives (1892-1954)",
          "subcategory": "bullion",
          "varieties": [],
          "weight_grams": 1.672,
          "year": 1905
        }
      ],
      "composition_periods": [
        {
          "alloy": {},
          "alloy_name": "Historical",
          "date_range": {
            "end": 1905,
            "start": 1904
          }
        }
      ],
      "official_name": "Lewis & Clark Exposition",
      "series_id": "Lewis & Clark Exposition",
      "series_name": "Lewis & Clark Exposition",
      "specifications": {
        "diameter_mm": 15.0,
        "edge": "plain"
      },
      "years": {
        "end": 1905,
        "start": 1904
      }
    },
    {
      "coins": [
        {
          "business_strikes": 15000,
          "category": "coin",
          "coin_id": "US-PPGD-1915-S",
          "composition": {},
          "diameter_mm": 15.0,
          "mint": "S",
          "proof_strikes": null,
          "rarity": "key",
          "source_citation": "Issue #53 - Classic Commemoratives (1892-1954)",
          "subcategory": "bullion",
          "varieties": [],
          "weight_grams": 1.672,
          "year": 1915
        }
      ],
      "composition_periods": [
        {
          "alloy": {},
          "alloy_name": "Historical",
          "date_range": {
            "end": 1915,
            "start": 1915
          }
        }
      ],
      "official_name": "Panama-Pacific Exposition",
      "series_id": "Panama-Pacific Exposition",
      "series_name": "Panama-Pacific Exposition",
      "specifications": {
        "diameter_mm": 15.0,
        "edge": "plain"
      },
      "years": {
        "end": 1915,
        "start": 1915
      }
    },
    {
      "coins": [
        {
          "business_strikes": 9977,
          "category": "coin",
          "coin_id": "US-MCKI-1916-P",
          "composition": {},
          "diameter_mm": 15.0,
          "mint": "P",
          "proof_strikes": null,
          "rarity": "key",
          "source_citation": "Issue #53 - Classic Commemoratives (1892-1954)",
          "subcategory": "bullion",
          "varieties": [],
          "weight_grams": 1.672,
          "year": 1916
        },
        {
          "business_strikes": 10000,
          "category": "coin",
          "coin_id": "US-MCKI-1917-P",
          "composition": {},
          "diameter_mm": 15.0,
          "mint": "P",
          "proof_strikes": null,
          "rarity": "key",
          "source_citation": "Issue #53 - Classic Commemoratives (1892-1954)",
          "subcategory": "bullion",
          "varieties": [],
          "weight_grams": 1.672,
          "year": 1917
        }
      ],
      "composition_periods": [
        {
          "alloy": {},
          "alloy_name": "Historical",
          "date_range": {
            "end": 1917,
            "start": 1916
          }
        }
      ],
      "official_name": "McKinley Memorial",
      "series_id": "McKinley Memorial",
      "series_name": "McKinley Memorial",
      "specifications": {
        "diameter_mm": 15.0,
        "edge": "plain"
      },
      "years": {
        "end": 1917,
        "start": 1916
      }
    },
    {
      "coins": [
        {
          "business_strikes": 5016,
          "category": "coin",
          "coin_id": "US-GRGS-1922-P",
          "composition": {},
          "diameter_mm": 15.0,
          "mint": "P",
          "proof_strikes": null,
          "rarity": "key",
          "source_citation": "Issue #53 - Classic Commemoratives (1892-1954)",
          "subcategory": "bullion",
          "varieties": [
            {
              "name": "With Star",
              "premium": false
            }
          ],
          "weight_grams": 1.672,
          "year": 1922
        }
      ],
      "composition_periods": [
        {
          "alloy": {},
          "alloy_name": "Historical",
          "date_range": {
            "end": 1922,
            "start": 1922
          }
        }
      ],
      "official_name": "Grant Memorial with Star",
      "series_id": "Grant Memorial with Star",
      "series_name": "Grant Memorial with Star",
      "specifications": {
        "diameter_mm": 15.0,
        "edge": "plain"
      },
      "years": {
        "end": 1922,
        "start": 1922
      }
    }
  ]
}