{
  "country": "US",
  "denomination": "$100 Gold",
  "face_value": 1.0,
  "series": [
    {
      "coins": [
        {
          "business_strikes": null,
          "category": "coin",
          "coin_id": "US-ALGD-2015-W",
          "composition": {},
          "designer": "Justin Kunz / Various",
          "diameter_mm": 30.61,
          "distinguishing_features": "Justin Kunz / Various",
          "mint": "W",
          "notes": "Issue #103",
          "obverse_description": "Liberty (design varies)",
          "proof_strikes": null,
          "rarity": null,
          "reverse_description": "Eagle",
          "subcategory": "numismatic",
          "total_mintage": null,
          "varieties": [],
          "weight_grams": 31.108,
          "year": 2015
        },
        {
          "business_strikes": null,
          "category": "coin",
          "coin_id": "US-ALGD-2016-W",
          "composition": {},
          "designer": "Justin Kunz / Various",
          "diameter_mm": 30.61,
          "distinguishing_features": "Justin Kunz / Various",
          "mint": "W",
          "notes": "Issue #103",
          "obverse_description": "Liberty (design varies)",
          "proof_strikes": null,
          "rarity": null,
          "reverse_description": "Eagle",
          "subcategory": "numismatic",
          "total_mintage": null,
          "varieties": [],
          "weight_grams": 31.108,
          "year": 2016
        },
        {
          "business_strikes": null,
          "category": "coin",
          "coin_id": "US-ALGD-2017-W",
          "composition": {},
          "designer": "Justin Kunz / Various",
          "diameter_mm": 30.61,
          "distinguishing_features": "Justin Kunz / Various",
          "mint": "W",
          "notes": "Issue #103",
          "obverse_description": "Liberty (design varies)",
          "proof_strikes": null,
          "rarity": null,
          "reverse_description": "Eagle",
          "subcategory": "numismatic",
          "total_mintage": null,
          "varieties": [],
          "weight_grams": 31.108,
          "year": 2017
        },
        {
          "business_strikes": null,
          "category": "coin",
          "coin_id": "US-ALGD-2018-W",
          "composition": {},
          "designer": "Justin Kunz / Various",
          "diameter_mm": 30.61,
          "distinguishing_features": "Justin Kunz / Various",
          "mint": "W",
          "notes": "Issue #103",
          "obverse_description": "Liberty (design varies)",
          "proof_strikes": null,
          "rarity": null,
          "reverse_description": "Eagle",
          "subcategory": "numismatic",
          "total_mintage": null,
          "varieties": [],
          "weight_grams": 31.108,
          "year": 2018
        },
        {
          "business_strikes": null,
          "category": "coin",
          "coin_id": "US-ALGD-2019-W",
          "composition": {},
          "designer": "Justin Kunz / Various",
          "diameter_mm": 30.61,
          "distinguishing_features": "Justin Kunz / Various",
          "mint": "W",
          "notes": "Issue #103",
          "obverse_description": "Liberty (design varies)",
          "proof_strikes": null,
          "rarity": null,
          "reverse_description": "Eagle",
          "subcategory": "numismatic",
          "total_mintage": null,
          "varieties": [],
          "weight_grams": 31.108,
          "year": 2019
        },
        {
          "business_strikes": null,
          "category": "coin",
          "coin_id": "US-ALGD-2020-W",
          "composition": {},
          "designer": "Justin Kunz / Various",
          "diameter_mm": 30.61,
          "distinguishing_features": "Justin Kunz / Various",
          "mint": "W",
          "notes": "Issue #103",
          "obverse_description": "Liberty (design varies)",
          "proof_strikes": null,
          "rarity": null,
          "reverse_description": "Eagle",
          "subcategory": "numismatic",
          "total_mintage": null,
          "varieties": [],
          "weight_grams": 31.108,
          "year": 2020
        },
        {
          "business_strikes": null,
          "category": "coin",
          "coin_id": "US-ALGD-2021-W",
          "composition": {},
          "designer": "Justin Kunz / Various",
          "diameter_mm": 30.61,
          "distinguishing_features": "Justin Kunz / Various",
          "mint": "W",
          "notes": "Issue #103",
          "obverse_description": "Liberty (design varies)",
          "proof_strikes": null,
          "rarity": null,
          "reverse_description": "Eagle",
          "subcategory": "numismatic",
          "total_mintage": null,
          "varieties": [],
          "weight_grams": 31.108,
          "year": 2021
        },
        {
          "business_strikes": null,
          "category": "coin",
          "coin_id": "US-ALGD-2022-W",
          "composition": {},
          "designer": "Justin Kunz / Various",
          "diameter_mm": 30.61,
          "distinguishing_features": "Justin Kunz / Various",
          "mint": "W",
          "notes": "Issue #103",
          "obverse_description": "Liberty (design varies)",
          "proof_strikes": null,
          "rarity": null,
          "reverse_description": "Eagle",
          "subcategory": "numismatic",
          "total_mintage": null,
          "varieties": [],
          "weight_grams": 31.108,
          "year": 2022
        },
        {
          "business_strikes": null,
          "category": "coin",
          "coin_id": "US-ALGD-2023-W",
          "composition": {},
          "designer": "Justin Kunz / Various",
          "diameter_mm": 30.61,
          "distinguishing_features": "Justin Kunz / Various",
          "mint": "W",
          "notes": "Issue #103",
          "obverse_description": "Liberty (design varies)",
          "proof_strikes": null,
          "rarity": null,
          "reverse_description": "Eagle",
          "subcategory": "numismatic",
          "total_mintage": null,
          "varieties": [],
          "weight_grams": 31.108,
          "year": 2023
        },
        {
          "business_strikes": null,
          "category": "coin",
          "coin_id": "US-ALGD-2024-W",
          "composition": {},
          "designer": "Justin Kunz / Various",
          "diameter_mm": 30.61,
          "distinguishing_features": "Justin Kunz / Various",
          "mint": "W",
          "notes": "Issue #103",
          "obverse_description": "Liberty (design varies)",
          "proof_strikes": null,
          "rarity": null,
          "reverse_description": "Eagle",
          "subcategory": "numismatic",
          "total_mintage": null,
          "varieties": [],
          "weight_grams": 31.108,
          "year": 2024
        },
        {
          "business_strikes": null,
          "category": "coin",
          "coin_id": "US-ALGD-2025-W",
          "composition": {},
          "designer": "Justin Kunz / Various",
          "diameter_mm": 30.61,
          "distinguishing_features": "Justin Kunz / Various",
          "mint": "W",
          "notes": "Issue #103",
          "obverse_description": "Liberty (design varies)",
          "proof_strikes": null,
          "rarity": null,
          "reverse_description": "Eagle",
          "subcategory": "numismatic",
          "total_mintage": null,
          "varieties": [],
          "weight_grams": 31.108,
          "year": 2025
        }
      ],
      "composition_periods": [
        {
          "alloy": {},
          "alloy_name": "Historical",
          "date_range": {
            "end": 2025,
            "start": 2015
          }
        }
      ],
      "official_name": "American Liberty Gold",
      "series_code": "ALGD",
      "series_id": "American Liberty Gold",
      "series_name": "American Liberty Gold",
      "specifications": {
        "diameter_mm": 30.61,
        "edge": "plain"
      },
      "years": {
        "end": 2025,
        "start": 2015
      }
    }
  ]
}