{
  "country": "US",
  "denomination": "5oz Silver",
  "face_value": 1.0,
  "series": [
    {
      "coins": [
        {
          "business_strikes": null,
          "category": "coin",
          "coin_id": "US-ATB5-2010-P",
          "composition": {},
          "diameter_mm": 76.2,
          "mint": "P",
          "notes": "Hot Springs National Park (AR)",
          "proof_strikes": null,
          "rarity": null,
          "source_citation": "Issue #77/#78 - America the Beautiful Series",
          "subcategory": "numismatic",
          "total_mintage": null,
          "varieties": [],
          "weight_grams": 155.52,
          "year": 2010
        },
        {
          "business_strikes": null,
          "category": "coin",
          "coin_id": "US-ATB5-2021-P",
          "composition": {},
          "diameter_mm": 76.2,
          "mint": "P",
          "notes": "Tuskegee Airmen National Park (AL)",
          "proof_strikes": null,
          "rarity": null,
          "source_citation": "Issue #77/#78 - America the Beautiful Series",
          "subcategory": "numismatic",
          "total_mintage": null,
          "varieties": [],
          "weight_grams": 155.52,
          "year": 2021
        },
        {
          "business_strikes": null,
          "category": "coin",
          "coin_id": "US-ATB5-XXXX-P",
          "composition": {},
          "diameter_mm": 76.2,
          "mint": "P",
          "notes": "Random year bullion - 5oz silver",
          "proof_strikes": null,
          "rarity": null,
          "source_citation": "Issue #77/#78 - America the Beautiful Series",
          "subcategory": "numismatic",
          "total_mintage": null,
          "varieties": [],
          "weight_grams": 155.52,
          "year": "XXXX"
        }
      ],
      "composition_periods": [
        {
          "alloy": {},
          "alloy_name": "Historical",
          "date_range": {
            "end": 2021,
            "start": 2010
          }
        }
      ],
      "official_name": "America the Beautiful 5oz Silver",
      "series_id": "America the Beautiful 5oz Silver",
      "series_name": "America the Beautiful 5oz Silver",
      "specifications": {
        "diameter_mm": 76.2,
        "edge": "plain"
      },
      "years": {
        "end": 2021,
        "start": 2010
      }
    }
  ]
}