{
  "country": "US",
  "denomination": "$10 Face Value",
  "face_value": 1.0,
  "series": [
    {
      "aliases": [
        "Junk Silver",
        "90% Silver",
        "Constitutional Silver",
        "$10 FV Silver",
        "Pre-1965 Silver",
        "90% Silver Bag"
      ],
      "coins": [
        {
          "business_strikes": null,
          "category": "coin",
          "coin_id": "US-JS90-XXXX-X",
          "composition": {},
          "designer": "Various (US Mint)",
          "distinguishing_features": "Various (US Mint)",
          "mint": "X",
          "notes": "Random year bullion - valued by metal content. Bag of pre-1965 US 90% silver coins (dimes, quarters, half dollars). $10 face value contains approximately 7.15 troy oz silver content. Valued by metal content.",
          "obverse_description": "Mixed pre-1965 US silver coins (dimes, quarters, half dollars)",
          "proof_strikes": null,
          "rarity": "common",
          "reverse_description": "Mixed pre-1965 US silver coins",
          "source_citation": "Official mint specifications",
          "subcategory": "circulation",
          "total_mintage": null,
          "varieties": [],
          "weight_grams": 715.0,
          "year": "XXXX"
        }
      ],
      "composition_periods": [
        {
          "alloy": {},
          "alloy_name": "Historical",
          "date_range": {
            "end": "XXXX",
            "start": "XXXX"
          }
        }
      ],
      "official_name": "Junk Silver 90% ($10 Face Value)",
      "series_code": "JS90",
      "series_id": "Junk Silver 90% ($10 Face Value)",
      "series_name": "Junk Silver 90% ($10 Face Value)",
      "specifications": {
        "edge": "plain"
      },
      "years": {
        "end": "XXXX",
        "start": "XXXX"
      }
    }
  ]
}