{
  "country": "US",
  "denomination": "Fifty Dollars",
  "face_value": 1.0,
  "series": [
    {
      "coins": [
        {
          "business_strikes": 645,
          "category": "coin",
          "coin_id": "US-PPEO-1915-S",
          "composition": {},
          "diameter_mm": 44.0,
          "mint": "S",
          "notes": "Extremely rare, octagonal version",
          "proof_strikes": null,
          "rarity": "key",
          "source_citation": "Issue #53 - Classic Commemoratives (1892-1954)",
          "subcategory": "bullion",
          "varieties": [],
          "weight_grams": 83.59,
          "year": 1915
        }
      ],
      "composition_periods": [
        {
          "alloy": {},
          "alloy_name": "Historical",
          "date_range": {
            "end": 1915,
            "start": 1915
          }
        }
      ],
      "official_name": "Panama-Pacific Exposition Octagonal",
      "series_id": "Panama-Pacific Exposition Octagonal",
      "series_name": "Panama-Pacific Exposition Octagonal",
      "specifications": {
        "diameter_mm": 44.0,
        "edge": "plain"
      },
      "years": {
        "end": 1915,
        "start": 1915
      }
    },
    {
      "coins": [
        {
          "business_strikes": 483,
          "category": "coin",
          "coin_id": "US-PPER-1915-S",
          "composition": {},
          "diameter_mm": 44.0,
          "mint": "S",
          "notes": "Extremely rare, round version",
          "proof_strikes": null,
          "rarity": "key",
          "source_citation": "Issue #53 - Classic Commemoratives (1892-1954)",
          "subcategory": "bullion",
          "varieties": [],
          "weight_grams": 83.59,
          "year": 1915
        }
      ],
      "composition_periods": [
        {
          "alloy": {},
          "alloy_name": "Historical",
          "date_range": {
            "end": 1915,
            "start": 1915
          }
        }
      ],
      "official_name": "Panama-Pacific Exposition Round",
      "series_id": "Panama-Pacific Exposition Round",
      "series_name": "Panama-Pacific Exposition Round",
      "specifications": {
        "diameter_mm": 44.0,
        "edge": "plain"
      },
      "years": {
        "end": 1915,
        "start": 1915
      }
    }
  ]
}