{
  "country": "US",
  "denomination": "Twenty Cents",
  "face_value": 0.2,
  "series": [
    {
      "coins": [
        {
          "business_strikes": 0,
          "coin_id": "US-VSHL-1774-L",
          "common_names": "[\"Virginia Shilling\", \"1774 Virginia Shilling Pattern\"]",
          "composition": {
            "silver": 0.925
          },
          "diameter_mm": 25.0,
          "distinguishing_features": "[\"Pattern/trial denomination\", \"Extremely rare with ~6 known\", \"Colonial Virginia coinage\", \"Silver composition\", \"Dated 1774\", \"Not issued for circulation\"]",
          "identification_keywords": "[\"virginia shilling\", \"colonial pattern\", \"1774 shilling\", \"virginia trial\", \"rare colonial\", \"silver colonial\"]",
          "mint": "L",
          "notes": "Extremely rare pattern/trial, approximately 6 known",
          "obverse_description": "George III bust right with 'GEORGIVS III REX' legend",
          "proof_strikes": 6,
          "rarity": "key",
          "reverse_description": "Crowned shield with 'VIRGINIA' and date '1774'",
          "source_citation": "APMEX Guide, Newman Numismatic Portal",
          "varieties": [],
          "weight_grams": 5.66,
          "year": 1793
        }
      ],
      "composition_periods": [
        {
          "alloy": {},
          "alloy_name": "Unknown",
          "date_range": {
            "end": 1793,
            "start": 1793
          },
          "weight": {
            "grams": 5.66
          }
        }
      ],
      "official_name": "Virginia Shilling",
      "series_id": "virginia_shilling",
      "series_name": "Virginia Shilling",
      "specifications": {
        "diameter_mm": 25.0,
        "edge": "plain"
      },
      "years": {
        "end": 1793,
        "start": 1793
      }
    },
    {
      "coins": [
        {
          "business_strikes": 730392,
          "coin_id": "CA-TWTY-1858-RM",
          "common_names": "1858 Twenty Cents",
          "composition": {
            "copper": 0.075,
            "silver": 0.925
          },
          "diameter_mm": 23.3,
          "distinguishing_features": "Single year issue, discontinued due to confusion with US quarter",
          "identification_keywords": "Victoria, maple leaves, twenty cents",
          "mint": "RM",
          "notes": "Only issued in 1858, replaced by 25-cent coin",
          "obverse_description": "Queen Victoria laureate bust left",
          "proof_strikes": null,
          "rarity": "scarce",
          "reverse_description": "Two maple leaves with denomination",
          "source_citation": "Issue #11 research",
          "varieties": [],
          "weight_grams": 4.648,
          "year": 1858
        }
      ],
      "composition_periods": [
        {
          "alloy": {},
          "alloy_name": "Unknown",
          "date_range": {
            "end": 1858,
            "start": 1858
          },
          "weight": {
            "grams": 4.648
          }
        }
      ],
      "official_name": "20 Cents",
      "series_id": "ca_20c",
      "series_name": "20 Cents",
      "specifications": {
        "diameter_mm": 23.3,
        "edge": "plain"
      },
      "years": {
        "end": 1858,
        "start": 1858
      }
    },
    {
      "coins": [
        {
          "business_strikes": 38500,
          "coin_id": "US-TWCT-1875-P",
          "common_names": "[\"Twenty Cent Piece\", \"Twenty Cents\", \"Seated Twenty\"]",
          "composition": {},
          "diameter_mm": 23.5,
          "distinguishing_features": "[\"[\\\"90% silver composition\\\", \\\"22mm diameter\\\", \\\"Short-lived denomination (1875-1878)\\\", \\\"Similar to quarter but smaller\\\", \\\"William Barber design after Gobrecht\\\"]\"]",
          "identification_keywords": "[\"twenty\", \"cent\", \"piece,\", \"twenty\", \"cents,\", \"seated\", \"liberty\", \"twenty,\", \"short\", \"lived\", \"coin,\", \"silver\", \"twenty,\", \"william\", \"barber,\", \"1875\", \"coin,\", \"confused\", \"with\", \"quarter\"]",
          "mint": "P",
          "notes": "Designed by William Barber (obverse after Christian Gobrecht)",
          "obverse_description": "Liberty seated on rock facing left, holding liberty pole with cap, shield with 'LIBERTY', stars around, date below",
          "proof_strikes": 0,
          "rarity": "scarce",
          "reverse_description": "Eagle with spread wings, 'UNITED STATES OF AMERICA' above, 'TWENTY CENTS' below",
          "source_citation": "Red Book 2024",
          "varieties": [],
          "year": 1875
        }
      ],
      "composition_periods": [
        {
          "alloy": {},
          "alloy_name": "Historical",
          "date_range": {
            "end": 1875,
            "start": 1875
          }
        }
      ],
      "official_name": "Twenty Cent Piece",
      "series_id": "two_cent",
      "series_name": "Twenty Cent Piece",
      "specifications": {
        "diameter_mm": 23.5,
        "edge": "plain"
      },
      "years": {
        "end": 1875,
        "start": 1875
      }
    }
  ]
}